{
  "type": "sequence",
  "caption": "Client retry",
  "legend": {
    "main": "Main path",
    "branch": "Alternative"
  },
  "participants": [
    {
      "id": "a",
      "label": "Client"
    }
  ],
  "messages": [
    {
      "id": "retry",
      "from": "a",
      "to": "a",
      "label": "retry"
    }
  ]
}
